filename,wave_size,text
sample-chap10-0.wav,234656,aaj devaveena kee shaadee kee risepshan thee
sample-chap10-1.wav,336084,amit subah se hee ghar aur yoonivarsitee klab ke beech bhaagadaud kar raha tha
sample-chap10-2.wav,235540,subah se keval ek hee baar vah veena se mila tha
sample-chap10-3.wav,342260,veena ko laga kuchh poochhana chaahata tha vah lekin kisee sankochavash vah poochh na saka
sample-chap10-4.wav,444572,aur yah baat use shaam ko samajh aa gaee thee jab deharaadoon se priya geeta va prem aa gae the
sample-chap10-5.wav,361664,unhen aaya dekhakar amit kee aankhon mein jo chamak aaee thee use vah chhipa na saka tha
sample-chap10-6.wav,354608,subah se veena ko vah jitana vyast lag raha tha ab utana hee nishchint laga use
sample-chap10-7.wav,264644,ab kal kee tarah vah veena ke aasapaas mandara raha tha
sample-chap10-8.wav,471032,prem to dev ke saath doosare kisee kamare mein tha aur veena apanee bahanon ke saath hanseethitholee mein magn thee
sample-chap10-9.wav,569816,veena ke chehare kee raunak kaheen bhee aisa kuchh aabhaas nahin karava rahee thee ki raat mein dev aur usake beech kuchh gambheer vaartaalaap hua hai
sample-chap10-10.wav,227600,teesaree baar jab amit aaya to veena ne use baithane ko kaha
sample-chap10-11.wav,303452,tab amit bola  kaise baithoon bhaabhee abhee to saans lene kee phursat bhee nahin hai
sample-chap10-12.wav,366956,yah to main dekh rahee hoon lekin abhee kuchh der se lagata hai tum kuchh bor ho rahe ho
sample-chap10-13.wav,133224,shaayad sab kaam poora ho chuka hai
sample-chap10-14.wav,429580,veena ko amit ke vyavahaar se usake kaam mein vyast rahane kee aadat se sukhad anubhooti ho rahee thee
sample-chap10-15.wav,109412,mera kaam to poora ho chuka hai
sample-chap10-16.wav,136752,bas ab taiyaar hona hai sabako
sample-chap10-17.wav,245240,amit ko sabako taiyaar karane kee bhee jimmedaaree thee
sample-chap10-18.wav,113824,haan sabhee taiyaar honge
sample-chap10-19.wav,124404,tum sabase pahale shuroo ho jao
sample-chap10-20.wav,202024,veena ne muskuraate hue usase kaha
sample-chap10-21.wav,271700,main sabase pahale kaise ho sakata hoon ghar mehamaanon se bhara hai
sample-chap10-22.wav,213488,sabako taiyaar karake hee mujhe mauka milega taiyaar hone ka
sample-chap10-23.wav,620972,aur jaise use kuchh aur yaad aaya  are komal bhaabhee aapako byootee sailoon le jaane vaalee theen na na jaane kya kar rahee hain  dekhakar aata hoon
sample-chap10-24.wav,197612,yah kahakar vah phir baahar nikal gaya
sample-chap10-25.wav,204668,veena usakee baat sunakar keval muskura bhar dee
sample-chap10-26.wav,185264,usane apanee bahan priya va geeta kee or dekha
sample-chap10-27.wav,180852,ve bhee amit kee or dekh muskura rahee theen
sample-chap10-28.wav,179092,amit kamare se nikala to veena ne kaha
sample-chap10-29.wav,90008,bahut achchha ladaka hai
sample-chap10-30.wav,95300,sabaka dhyaan rakhata hai
sample-chap10-31.wav,183500,aapaka to kuchh jyaada hee rakh raha hai
sample-chap10-32.wav,54728,geeta ne kaha
sample-chap10-33.wav,278756,haan lekin sabake lie har kaam karane ko taiyaar rahata hai
sample-chap10-34.wav,214368,kal se dekh rahee hoon saare ghar mein chhaaya hua hai
sample-chap10-35.wav,368720,aur jaise use kuchh yaad ho aaya ho vah priya va geeta se bolee  tum ekado din rukogee na
sample-chap10-36.wav,147340,bhaiya kah rahe the kal chale jaenge
sample-chap10-37.wav,97064,priya ne kaha
sample-chap10-38.wav,57372,nahin kal nahin
sample-chap10-39.wav,237304,abhee vah pooree baat kah bhee na paee thee ki amit phir se aa gaya
sample-chap10-40.wav,351080,amit ne veena ka shabd sun liya tha  kal nahin kya  usane poochh liya
sample-chap10-41.wav,344024,veena muskuraatee huee bolee  yoon hee priya kah rahee thee kal vaapis jaane ke lie
sample-chap10-42.wav,271700,are kal hee  priya kee or dekha usane phir veena ko kaha
sample-chap10-43.wav,155276,kal kyon jaengee do chaar din ruk kar jaen
sample-chap10-44.wav,128816,inhonne dillee nahin dekhee hogee
sample-chap10-45.wav,107648,main sab ghuma doonga
sample-chap10-46.wav,102356,geeta sunakar khush ho gaee
sample-chap10-47.wav,367836,lekin priya ne kaha  vaise bhee main kahaan ruk sakatee hoon agale haphte mere praiktikal shuroo hone hain
sample-chap10-48.wav,109412,tabhee komal bheetar aa gaee
sample-chap10-49.wav,193204,usako dekhakar amit ka hausala aur badh gaya
sample-chap10-50.wav,273464,vah usee kee or aamukh hokar bola  hamen kya aitaraaj ho sakata hai
sample-chap10-51.wav,199376,lekin komal bhaabhee jaane degee tab na
sample-chap10-52.wav,238184,kisako jaane degee jara main bhee to jaanoon  komal ne kaha
sample-chap10-53.wav,114704,priya va geeta ko
sample-chap10-54.wav,51200,veena ne bataaya
sample-chap10-55.wav,135872,are yah kaise ho sakata hai
sample-chap10-56.wav,90008,is haphte hamaare saath rahen
sample-chap10-57.wav,77660,dillee ghoomen
sample-chap10-58.wav,232008,agale haphte tum va dev deharaadoon chakkar lagaane jaoge hee
sample-chap10-59.wav,117352,tumhaare saath hee vaapis chalee jaengee
sample-chap10-60.wav,534536,komal jaise amit ke man kee chaahana ko bhaanp chukee thee amit ko muskuraate dekhakar phir bolee  kyon amit theek rahega na
sample-chap10-61.wav,149984,haanhaan main to pahale hee kah raha tha
sample-chap10-62.wav,239948,lekin komal kee arthapoorn muskuraahat dekhakar vah jhempasa gaya
sample-chap10-63.wav,238184,tab komal veena ko lekar byootee sailoon jaane ko chal dee
sample-chap10-64.wav,160568,amit shesh taiyaaree mein jut gaya
sample-chap10-65.wav,208196,paartee badee dhoomadhaam se sampann ho gaee
sample-chap10-66.wav,116468,veena ka man khush ho gaya
sample-chap10-67.wav,630672,dev ke naaterishtedaar dev ke mitr use jitane pyaar se mile aur usane yah baarabaar mahasoos kiya ki apane samaaj mein dev kee bahut ijjat hai
sample-chap10-68.wav,302572,sabhee usake gyaan kee usake svabhaav kee prashansa kar rahe the
sample-chap10-69.wav,229364,veena ko yah sab dekhakar svayan par garv mahasoos hua
sample-chap10-70.wav,382832,priya va geeta bhee aisa dekhakar bahut khush hueen
sample-chap10-71.wav,202904,prem ko to amit ne apane paas se hilane hee na diya tha
sample-chap10-72.wav,240832,paartee se lautakar dev va veena jab apane kamare mein aa gae
sample-chap10-73.wav,207312,tab dev ne poochha veena se  kaisa laga sab tumhen
sample-chap10-74.wav,110296,bahut achchha
sample-chap10-75.wav,192320,veena ne muskuraate hue dev ko dekhate hue kaha
sample-chap10-76.wav,184380,tab tak dev ne sigaret sulaga lee thee
sample-chap10-77.wav,297280,use aisa karate dekhakar veena ne kaha  aapako sigaret nahin peenee chaahie
sample-chap10-78.wav,121760,kuchh nahin hota isase
sample-chap10-79.wav,121760,dev ne laaparavaahee se kaha
sample-chap10-80.wav,402236,tabhee use kuchh yaad aaya bola  mainne baaton hee baaton mein ramesh bhaee se poochha tha
sample-chap10-81.wav,259352,unhen bataaya ki tum mere opareshan ke baare mein kuchh nahin jaanateen
sample-chap10-82.wav,179088,ramesh bhaee is baat ko lekar pareshaan ho gae
sample-chap10-83.wav,152632,unhen mainne aur nahin kureda
sample-chap10-84.wav,490436,ab kya sach hai aur kya jhooth yah to bata paana mushkil hai main svayan ko hee gunaahagaar mahasoos kar raha hoon
sample-chap10-85.wav,128816,veena kee muskuraahat phir lupt ho gaee
sample-chap10-86.wav,266408,bolee  dekhie main ab is bahas mein nahin padana chaahatee
sample-chap10-87.wav,187028,mujhe jo maaloom tha vah mainne aapako bata diya hai
sample-chap10-88.wav,382832,aur ab main baarabaar us baat ko sochakar apane mastishk ka santulan nahin bigaadana chaahatee
sample-chap10-89.wav,436632,mujhe aapakee baat par vishvaas karane ko jee chaahata hai aur iseelie mere man mein ab koee gila nahin hai
sample-chap10-90.wav,155276,veena kee aankhen nam ho aaee theen
sample-chap10-91.wav,392536,vah kahatee rahee  mainne aap jaise pati kee hee kalpana kee thee aur vah meree pooree ho gaee
sample-chap10-92.wav,430460,ab mere man mein sada yahee chaahana rahegee ki mere aur aapake beech ekadoosare ko samajhane kee bhaavana banee rahe
sample-chap10-93.wav,135872,aap ab achchhebhale hain
sample-chap10-94.wav,296396,main to yahee praarthana karatee rahoongee ki aap hamesha tandurust rahen
sample-chap10-95.wav,171152,dev shaayad yahee sunana chaah raha tha
sample-chap10-96.wav,643904,apane man kee aavaaz apanee har ichchha ko ek nae roop mein nikharate dekhane kee chaah itanee balavatee ho gaee thee usamen ki is sachajhooth ke bhanvar mein phansana hee nahin chaah raha tha
sample-chap10-97.wav,485144,jo ho chuka hai isako kuredana vah isalie nahin chaahata tha ki usakee part ke peechhe chhipa ghaav bahut zahareela tha
sample-chap10-98.wav,179972,tum vaastav mein bahut bade dil vaalee ho veena
sample-chap10-99.wav,389888,dev ne usase kaha phir apanee sigaret bujha dee aur veena ko apanee baanhon mein le liya
sample-chap10-100.wav,148220,veena ke badan mein jhurajhureesee daud gaee
sample-chap10-101.wav,479852,ek kshan pashchaat hee sanyat hokar dev se usane vinateeyukt svar mein kaha  aapako ek vaayada karana hoga mujhase
sample-chap10-102.wav,116468,ek nahin hajaar bolo
sample-chap10-103.wav,81188,dev ne kaha
sample-chap10-104.wav,225836,vah veena par sarvasv nyauchhaavar karane ko taiyaar tha
sample-chap10-105.wav,409292,bas keval ek hee aap aaj ke baad kisee se bhee is vishay mein koee baat nahin karoge
sample-chap10-106.wav,271700,na apane kisee bhaee se aur na hee mere kisee parivaar ke sadasy se
sample-chap10-107.wav,569816,aapakee har pareshaanee mein main aapake saath rahoongee aur main nahin chaahatee ki main apaneeaapakee kisee baat kee raay apane kisee parivaar ke sadasy se loon
sample-chap10-108.wav,81188,kuchh rukee veena
sample-chap10-109.wav,508076,punah bolee  main nahin chaahatee ki main apane maataapita bhaeebahanon ko aisa kuchh bata kar unakee chintae vyarth mein badha doon
sample-chap10-110.wav,276108,aap kah rahe hain aur mujhe vishvaas hai ki aapako kuchh aur nahin hoga
sample-chap10-111.wav,217900,unako kuchh bataoongee to vyarth mein vah chinta karenge
sample-chap10-112.wav,227600,mere maataapita ne ham sab bahanon ko achchhee shiksha dilaee hai
sample-chap10-113.wav,238184,badee kathin paristhitiyon mein unhonne hamen paalapos kar bada kiya hai
sample-chap10-114.wav,201140,main unhen aur chinta karate nahin dekh sakatee
sample-chap10-115.wav,303452,aur meree sabase badee tamanna hai ki mera apana ek ghar ho chhotaasa
sample-chap10-116.wav,292868,jahaan main aur tum bina kisee ke dakhal ke apana jeevan vyateet kar saken
sample-chap10-117.wav,209076,dev veena ke shabd sunakar aatmavibhor ho utha tha
sample-chap10-118.wav,96184,bola  veena
sample-chap10-119.wav,271700,tumhaare vichaar jaanakar mujhe lag raha hai main bahut bhaagyashaalee hoon
sample-chap10-120.wav,146456,tum jo kahogee main vaisa hee karoonga
sample-chap10-121.wav,268172,phir kuchh ruk kar bola  ab ham apanee baaten yaheen samaapt karen
sample-chap10-122.wav,278756,bahut raat ho gaee hai aur tum bhee do raaton se theek se nahin so sakee ho
sample-chap10-123.wav,128816,hamen ab aaraam karana chaahie
sample-chap10-124.wav,178208,itana kahakar dev ne battee band kar dee
sample-chap10-125.wav,63548,aur palang par let gaya
sample-chap10-126.wav,310508,neend koson door thee donon kee aankhon se
sample-chap10-127.wav,251412,shaadee kee doosaree raat dev veena ko chhoona chaahata tha
sample-chap10-128.wav,111176,use sahalaana chaahata tha
sample-chap10-129.wav,119116,use pyaar dena chaahata tha
sample-chap10-130.wav,163212,usase sahavaas kee ichchha thee
sample-chap10-131.wav,126172,lekin jhijhak raha tha
sample-chap10-132.wav,352844,jo lalak thee usamen veena ko pyaar dene kee veena se pyaar paane kee vah dab gaee thee
sample-chap10-133.wav,463976,yahee chaah raha tha ki veena use chhoo le bas itanee bhar pahal vah kar le shesh vah sab karega
sample-chap10-134.wav,467504,aur udhar veena andhere kamare mein seedhee letee chhat mein kuchh aakrtiyaan banateebigadatee dekhane kee koshish kar rahee thee
sample-chap10-135.wav,438396,man mein usake bhee chaah balavatee hotee ja rahee thee ki saath lagabhag chhah inch door leta dev use ab chhoo le
sample-chap10-136.wav,367840,premil kshanon kee chaah kis aurat mein nahin hotee kise achchha nahin lagata purush ka sparsh
sample-chap10-137.wav,340496,is chuppee ko kaun tode is chuppee se to aur adhik dooree badh jaegee
sample-chap10-138.wav,345788,abhee to man maan nahin raha veena ka ki kabhee kuchh hua bhee tha dev ke saath
sample-chap10-139.wav,377540,abhee to yahee chaah hai ki jis khushee se usane dev se shaadee kee hai usamen chaarachaand lag jaen
sample-chap10-140.wav,74132,dev use chhoo le
sample-chap10-141.wav,118232,dev use sahala le
sample-chap10-142.wav,109412,vah dev ka pyaar pa le
sample-chap10-143.wav,160568,aur usake pyaar mein kho jae
sample-chap10-144.wav,54728,bhool jae sab
sample-chap10-145.wav,227600,bhool jae ki jo ho chuka hai usamen usaka bhavishy nahin chhipa
sample-chap10-146.wav,269936,jo ho raha hai aur jo aage hoga vahee usaka bhavishy hai
sample-chap10-147.wav,121760,vahee naee raah banaega
sample-chap10-148.wav,201140,vahee nae sapanon ka nirmaan karega
sample-chap10-149.wav,105884,jo sukh ab use milane ja raha hai
sample-chap10-150.wav,217016,jo sukh use milega vahee usaka bhavishy sanvaarega
sample-chap10-151.wav,63548,vahee sukh
sample-chap10-152.wav,148220,usake nae jeevan mein naene roop banaega
sample-chap10-153.wav,271700,dev ke sansarg ke sukh se oopar use kuchh nahin lag raha tha
sample-chap10-154.wav,224072,dev ke sparsh ko paane ko vah bhee betaab thee
sample-chap10-155.wav,254060,jo pahale tanaav se mukt hoga vahee aage badh paega
sample-chap10-156.wav,373128,aur donon ekasaath is tanaav se mukt hone ko taiyaar hone kee cheshta karane lage
sample-chap10-157.wav,143812,dev ne halke se haath badhaaya
sample-chap10-158.wav,382832,veena bhee apana haath badha rahee thee aur palabhar mein hee haathon ka sparsh donon ne mahasoos kiya
sample-chap10-159.wav,234656,agale hee pal donon ekadoosare kee or badh gae the
sample-chap10-160.wav,195848,prem kee deevaanagee mein aalinganabaddh ho gae donon
sample-chap10-161.wav,192320,kamare mein andhera tha aur baahar chaandanee raat thee
sample-chap10-162.wav,148220,samudr mein toophaan aa gaya tha
sample-chap10-163.wav,164096,laharen ekadoosare ka aalingan kar rahee theen
sample-chap10-164.wav,375776,do laharen ooncha uthakar aasamaan ko chhoone ko betaab theen jaise ek ho jaane kee chaah thee unamen
sample-chap10-165.wav,232008,ek hee ginatee ho ek hee kahalaen jaise vah donon
sample-chap10-166.wav,217900,veena ko yah toophaan bahut achchha lag raha tha
sample-chap10-167.wav,263760,dev ka sparsh dev ka aalingan use nae yug kee shurooaat lag rahee thee
sample-chap10-168.wav,360784,abhee toophaan joron par tha ki dev kee umangon kee lahar ekaek dheelee pad gaee
sample-chap10-169.wav,148220,dev ekaek past ho gaya
sample-chap10-170.wav,202904,ekaek bijalee kaundhee aur dev ko nidhaal kar gaee
sample-chap10-171.wav,199376,vah apanee saanson ko aur adhik na rok paaya
sample-chap10-172.wav,194084,lekin veena ka toophaan apanee gati abhee banae tha
sample-chap10-173.wav,164096,vah dev ko apane se alag na kar paee
sample-chap10-174.wav,243476,dev ke haath ko usane apane shareer se alag na hone diya
sample-chap10-175.wav,336968,jaise bijalee ka karant chalane par bhee shareer apanee gati nahin pakad pa raha tha
sample-chap10-176.wav,197612,dev ke man ko veena ke man kee pahachaan karanee thee
sample-chap10-177.wav,197612,vah nidhaal tha magar veena kee ichchha ko jaan gaya
sample-chap10-178.wav,169388,vah veena ke har ang ko sahalaata raha
sample-chap10-179.wav,160568,use laga veena ko aanand mil raha hai
sample-chap10-180.wav,578636,vah ruka nahin bas usakee anguliyaan veena ke shareer mein ekek karake pravesh karatee raheen aur veena bhee chand minaton mein shaant ho gaee
sample-chap10-181.wav,273464,veena ko yah sukh kaisa laga yah nahin jaan paaya vah
sample-chap10-182.wav,105884,poochh bhee nahin saka usase
sample-chap10-183.wav,148220,bas aise hee donon kee aankh lag gaeen
sample-chap10-184.wav,241712,subah mahasoos hua use ki dev usase phir lipata hua hai
sample-chap10-185.wav,167624,vah pyaar paane ko utaaroo hai
sample-chap10-186.wav,227600,jaise beetee raat ka toophaan phir se bekaaboo ho gaya hai
sample-chap10-187.wav,254060,lekin yah toophaan veena ko chand minaton ka laga
sample-chap10-188.wav,112940,dev phir se nidhaal ho gaya
sample-chap10-189.wav,125288,veena kuchh samajh na paee
sample-chap10-190.wav,471032,abhee vah kuchh sochatee ki dev ne phir se sigaret sulaga lee aur kash lete hue bola  veena mujhe maaph karana
sample-chap10-191.wav,217016,main svayan ko maanasik tanaav se mukt nahin kar pa raha
sample-chap10-192.wav,165860,mere is tanaav ko anyatha na lena
sample-chap10-193.wav,266408,main jald hee is tanaav se mukt ho jaoonga aur sab theek ho jaega
sample-chap10-194.wav,217016,veena kya kahatee sunakar chup hee rahee
sample-chap10-195.wav,553056,dev ke vyaktitv kee is kamajoree ko bhee veena ne daba liya apane man ke bheetar
sample-chap10-196.wav,225836,apane man kee baat apane mein hee chhipaaye rahatee thee
sample-chap10-197.wav,299040,teen din rahe the vah deharaadoon aur geeta ne apanee har samasya ka samaadhaan pa liya tha
sample-chap10-198.wav,655372,ek madhyam vargeey shikshit parivaar kya chaahata hai ekamaatr yahee chaah hotee hai ki jaisee shiksha ve apane bachchon ko de rahe hain vaisa hee jeevan saathee unhen mil jae
sample-chap10-199.wav,245240,achchhee naukaree vaala hoga to jeevan sudhar jaega unake bachche ka
sample-chap10-200.wav,250532,aise mein dev ko paakar veena ke maataapita phoole nahin samaate the
sample-chap10-201.wav,315800,aur dev ne bhee apane priyadarshee svabhaav se unhen apana divaana bana diya tha
sample-chap10-202.wav,255824,sabase patravyavahaar usakee dinacharya ka ek ang ban gaya tha
sample-chap10-203.wav,470148,aise mein kaheen kisee bhee bhaav se veena ne kisee ko bhee is baat kee bhanak nahin padane dee ki dev ke shareer mein kaheen kuchh kamee hai
sample-chap10-204.wav,563644,haan deharaadoon mein sabane ek baat jaroor not kee thee ki subahasavere dev ko pateela bhar kar garm paanee kee jaroorat padatee hai
sample-chap10-205.wav,146456,baatharoom mein vah lagabhag paun ghanta lagaata hai
sample-chap10-206.wav,195848,kaaran chaahakar bhee koee na poochh saka
sample-chap10-207.wav,100592,na dev se na veena se
sample-chap10-208.wav,330792,aakhir koee shanka aur kaheen dikhatee tabhee yah bhaav kuchh ulte roop se man mein aata
sample-chap10-209.wav,273464,aise mein veena ke man kee baat veena kee nijee baat hee hokar rah gaee
sample-chap10-210.wav,131464,vahee dev kee dinacharya se parichit thee
sample-chap10-211.wav,154392,dev subah chhah baje uth jaata tha
sample-chap10-212.wav,186148,tab vah jaldee se chaay banaakar le aatee thee
sample-chap10-213.wav,277872,tatpashchaat usake lie vah ek bada pateela bhar kar paanee garam karatee thee
sample-chap10-214.wav,678304,yah paanee vah pahale apane krtrim maladvaar se pamp karake bheetar karata tha phir usee tarah pamp karake paanee aur shareer ka saara mal baahar nikaalata tha
sample-chap10-215.wav,418112,veena ne pahale din yah prakriya dekhane kee ichchha jaahir kee thee aur dev ke na nukar karane par bhee nahin maanee thee
sample-chap10-216.wav,398708,dev tab use rok nahin saka tha aur veena baatharoom mein usake paas khadee hokar dekhatee rahee thee
sample-chap10-217.wav,390768,is prakriya ke dauraan use kaee baar ubakaee aane ko huee lekin usane use roke rakha
sample-chap10-218.wav,260236,dev ko is prakriya mein lagabhag paun ghanta lag jaata tha
sample-chap10-219.wav,116468,isase vah thak bhee jaata tha
sample-chap10-220.wav,292868,lekin opareshan ke baad lage baig se yah prakriya adhik suvidhaapoorn thee
sample-chap10-221.wav,270816,lagabhag chaibees ghante use koee pareshaanee nahin hotee thee
sample-chap10-222.wav,327268,naha dhokar das baje ke lagabhag dev kolej chala jaata tha aur do baje vaapis lautata tha
sample-chap10-223.wav,239064,khaana khaakar ek ghanta tak apanee risarch ka kaam karata tha
sample-chap10-224.wav,183500,veena ko usakee padhaee karane kee aadat bahut achchhee lagatee thee
sample-chap10-225.wav,336968,dev ka ganit kee ati vikasit shaakha ka goodh gyaan usakee samajh se pare tha
sample-chap10-226.wav,263764,is beech vah dev ke lie kuchh na kuchh khaane ko banaatee rahatee thee
sample-chap10-227.wav,187028,saat baje ke baad donon ghoomane nikal jaate the
sample-chap10-228.wav,770912,ekadedh ghante baad laut kar veena rasoeeghar mein apanee saas ka haath bantaane ke lie ghus jaatee thee aur dev kisee patrika ke panne palatata rahata tha
