filename,wave_size,text
sample-chap25-0.wav,204668,dev ko gujare ek maah ho chala tha
sample-chap25-1.wav,178208,veena ek dam khaalee ho gaee thee
sample-chap25-2.wav,132344,koee kaam nahee tha usake paas
sample-chap25-3.wav,218780,sabhee kee koshish rahatee thee ki koee na koee usake paas bana rahe
sample-chap25-4.wav,628028,pahale kuchh din to pramod va komal donon dopahar baad aa jaate the aur raat der tak vaheen ruke rahate the unake upasthiti mein veena ko achchha lagata tha
sample-chap25-5.wav,268172,lekin maan krashna ko unaka yoon roj chala aana akharane laga tha
sample-chap25-6.wav,211724,kyonki pramod kee upasthiti unhen dev kee baaten hee yaad karaatee thee
sample-chap25-7.wav,441044,vah har baat ko lekar beechabeech mein ek baat hee kahatee pramod se tumhen dekhatee hoon to dev yaad ho aata hai
sample-chap25-8.wav,199376,usaka duhkh chaahakar bhee kam nahee kar paate
sample-chap25-9.wav,95300,dev yaad sabhee ko aata tha
sample-chap25-10.wav,250532,lekin yaad ko baarabaar kuredana achchha nahee lagata doosaron ko
sample-chap25-11.wav,252296,dheeredheere pramodakomal ka aana kam hone laga
sample-chap25-12.wav,409292,amit veena ko dekhata to sochata ki yahee sthiti banee rahee to veena vakt gujarane ke saatasaat bilkul nishkriy ho jaegee
sample-chap25-13.wav,222308,aise mein vah dev ke saathee prophesar tripaathee se milane chala gaya
sample-chap25-14.wav,243476,prophesar tripaathee dev ke saath hee khaalasa kaalej mein padhaate the
sample-chap25-15.wav,157040,unaka achchha dabadaba bhee tha kaalej mein
sample-chap25-16.wav,428696,dopahar jab vah kaalej mein pahuncha us samay vah staapharum mein baithe apane doosare saathiyon ke saath baatacheet mein magn the
sample-chap25-17.wav,222308,amit ko dekhate hee badee garmajoshee se uthakar usase mile
sample-chap25-18.wav,179972,aao amit main subah hee tumhen yaad kar raha tha
sample-chap25-19.wav,262880,apane paas bithaate hue bole kaho kaise chal raha hai
sample-chap25-20.wav,98828,sab theek hai tripaathee saahab
sample-chap25-21.wav,269936,kaee dinon se aapase milane kee soch raha tha aur aaj aapase milane chala aaya
sample-chap25-22.wav,74132,amit ne kaha
sample-chap25-23.wav,359900,achchha kiya main svayan tumase milakar veena jee kee saitalamaint ke vishay mein baat karana chaah raha tha
sample-chap25-24.wav,165860,amit ke man kee baat ko jaise unhone bhaanp liya ho
sample-chap25-25.wav,128816,svayan hee unhonne baat chhed dee
sample-chap25-26.wav,335204,isee beech amit ko dekhakar any kaee lekcharaar jo use dev ke sandarbh mein jaanate the chale aae
sample-chap25-27.wav,201140,sabakee baatacheet ka kendr veena hee ban gaee thee
sample-chap25-28.wav,278756,kya socha hai veena jee ne apane lie prashn prophesar jasapaal sinh ka tha
sample-chap25-29.wav,162332,abhee to vah sambhalee bhee nahin hain apane duhkh se
sample-chap25-30.wav,354608,lekin main chaahata hoon kaalej kee taraph se yadi koee aashvaasan mil jaata dev kee post ke evaj mein
sample-chap25-31.wav,299924,kaalej unhen yadi lekcharaar ke rup mein niyukt kar de to bahut achchha hoga unake lie
sample-chap25-32.wav,90008,amit ne apanee baat kahee sabase
sample-chap25-33.wav,104120,kyon nahin kyon nahin
sample-chap25-34.wav,109412,ek saath teenachaar sammilit svar ubhare
sample-chap25-35.wav,234656,veena jee emesasee hai na ek ne poochha
sample-chap25-36.wav,224072,jee haan shaadee se pahale to vah kendriy vidyaalay mein padhaatee thee
sample-chap25-37.wav,375776,dev kee beemaaree ke dauraan koshish kee traansaphar kee aur jab traansaphar nahee huee to unhonne tyaagapatr de diya
sample-chap25-38.wav,135872,bahutabadee galatee kar dee unhonne
sample-chap25-39.wav,160568,itanee achchhee naukaree nahee chhodanee chaahie thee
sample-chap25-40.wav,118232,bina tanakhvaah ke chhuttee le letee
sample-chap25-41.wav,119996,prophesar tripaathee ne kaha
sample-chap25-42.wav,714464,tab socha tha dev theek ho jaega to dubaara se koshish kar legee aur phir unhonne socha tha dev ke theek hone ke baad vah peeechadee karengee aur tab kaalej kee naukaree hee behatar rahegee unake lie
sample-chap25-43.wav,72368,amit ne saphaee dee
sample-chap25-44.wav,195848,khair ab jo ho gaya usako sochane ka koee phaayada nahee
sample-chap25-45.wav,264644,ab to prinsipal saahab ko mil kar kahana chaahie kuchh karane ko
sample-chap25-46.wav,322856,yah sujhaav prophesar mattoo ka tha jise dev kee salaah par hee naukaree ke lie chuna gaya tha
sample-chap25-47.wav,756800,tab prophesar tripaathee ne amit se kaha amit aise mein behatar hoga tum kal hee veena jee kee taraph se ek praarthanaapatr banaakar le aao behatar rahega unhen saath lekar hee prinsipal saahab se mil lo
sample-chap25-48.wav,176444,ham bhee aaj ya kal unase milakar baat kar lenge
sample-chap25-49.wav,243476,aur aage kee yojana usake baad hee banaen to theek rahega
sample-chap25-50.wav,112940,jaisa aap behatar samajhen
sample-chap25-51.wav,139400,main kal hee unhen lekar aa jaunga
sample-chap25-52.wav,225836,amit ne kaha aur uthane ka upakram karate hue bola achchha chalata hoon
sample-chap25-53.wav,52964,kal miloonga
sample-chap25-54.wav,187028,aur sabase haath milaakar vah baahar nikal aaya
sample-chap25-55.wav,688004,tab usake saathasaath prophesar mattoo bhee baahar aa gae amit dev ke provident phand ke lie bhee phaarm bhaarana hoga aur haan kal main teechars velapheyar phand ka bhee phaarm mangava loonga
sample-chap25-56.wav,372248,usake antargat kisee bhee teechar kee aakasmik mratyu par rupaye dene ka praavadhaan hai
sample-chap25-57.wav,164096,yah sunakar amit ne kaha mattoo bhaee
sample-chap25-58.wav,497492,aaj hamen rupayepaise kee jarurat nahin jarurat hai bhaabhee ko sahaara den kee unake khaleepan ko door karane kee
sample-chap25-59.wav,199376,unake lie koee raasta ban jae bas yahee kaamana keejie
sample-chap25-60.wav,305216,main tumhaare saath hoon amit mujhase aur any sabhee se jo ban padega vah ham karenge
sample-chap25-61.wav,252296,tab prophesar mattoo se haath milaakar amit ne vida lee
sample-chap25-62.wav,181736,agale din veena ko saath lekar amit kaalej pahunch gaya
sample-chap25-63.wav,188792,prinsipal saahab bahut achchhee tarah mile
sample-chap25-64.wav,356372,unake vyavahaar se laga ki jaise prophesar tripaathee ne unase is sambandh mein pahale se hee baat kar lee thee
sample-chap25-65.wav,576872,veena kee arjee ko dekhane ke baad vah bole dekhie veena jee main apanee taraph se pooree koshish karunga ki aapako teeching laeen mein hee koee aaphar dee ja sake
sample-chap25-66.wav,365192,lekin meree apanee raay mein behatar hoga ki aap teeching kee apeksha edaministreshan kee jaab hee len
sample-chap25-67.wav,167624,aisa kyon sar veena unhen dekhate hue bolee
sample-chap25-68.wav,61784,aap svayan dekhie
sample-chap25-69.wav,255824,lagabhag gyaarah varsh pahale apane kaalej kee padhaee pooree kee thee
sample-chap25-70.wav,148220,usake baad aapane praimaree teechar kee naukaree kee
sample-chap25-71.wav,190556,ab dhaee saal se bilkul kuchh nahin kar rahee hain
sample-chap25-72.wav,550412,ek tarah se apane vishay se aap lambe samay se bilkul bhee tach mein nahin hain aise mein kaalej star kee padhaee karavaana bilkul sambhav nahin hoga
sample-chap25-73.wav,128816,unhonne apanee raay spasht kar dee
sample-chap25-74.wav,169388,main mehanat se apane vishay ko phir se grahan kar loongee
sample-chap25-75.wav,285812,phir kuchh rukee aur bolee lekin phir bhee aap jo uchit samajhen vah keejie
sample-chap25-76.wav,236420,amit ko tab laga antim vaaky bhaabhee ko nahin kahana chaahie tha
sample-chap25-77.wav,176444,ve donon tab unase vida lekar baahar nikale
sample-chap25-78.wav,513368,staapharum mein pahunch kar jab amit ne saaree baat prophesar tripaathee se kahee to unhonne bhee kaha bhaabhee jee aapake antim vaaky se sab gadabad ho gaee
sample-chap25-79.wav,234656,ab vah yahee kahenge ki aapako koee klairikal jaab de dee jae
sample-chap25-80.wav,146456,vah to main karungee nahee tab veena ne kaha
sample-chap25-81.wav,132344,vah to aapako unheen se kahana hoga
sample-chap25-82.wav,97064,tab prophesar tripaathee ne kaha
sample-chap25-83.wav,183500,chalie unhen koee prapojal to dene deejie
sample-chap25-84.wav,91772,tabhee baat kee jaegee
sample-chap25-85.wav,79424,tab amit ne kaha
sample-chap25-86.wav,402236,amit tumhaaree baat theek hai lekin aajakal jamaana doosare kee raay apane upar laadane ka nahin hai
sample-chap25-87.wav,329912,aaj to avasar milate hee achchhee naukaree haasil karane ke lie sabhee neetiyaan apanaanee padatee hai
sample-chap25-88.wav,333440,laikcharaaraship ke lie jo nyoonatam yogyata honee jaruree hai vah to hai phir kaahe ka dar
sample-chap25-89.wav,162332,ek baar naukaree mil jae phir sab theek ho jaata hai
sample-chap25-90.wav,271700,phir dheere se phusaphusaate hue bole ye log bhool rahe hai
sample-chap25-91.wav,250532,prophesar jasapaal kee patnee ko dev ne hee niyukt karavaaya tha
sample-chap25-92.wav,241712,chaahe raajaneetik davaab ke kaaran unakee patnee ko naukaree milee thee
sample-chap25-93.wav,239948,lekin dekho donon patipatnee ek hee kaalej mein laikcharaar hai
sample-chap25-94.wav,134108,donon kee hee eme saikind diveejan
sample-chap25-95.wav,421640,amit ko laga prophesar tripaathee sahaanubhooti prakat kar aisee baate kar apane ko unaka sabase bada himaayatee saabit karana chaahate hai
sample-chap25-96.wav,451628,bhaabhee ke paristhiti doosaree hai tripaathee saahab unhen aaj hausala dekar kaha jaana chaahie ki aap yah karen ham aapake saath hai
sample-chap25-97.wav,79424,amit ne kaha
sample-chap25-98.wav,90008,yahee to mai kah raha hoon
sample-chap25-99.wav,93536,ham sab inake saath hai
sample-chap25-100.wav,280520,ab aap prinsipal saahab se phir milana aur laikcharaaraship ke lie hee jor dena
sample-chap25-101.wav,291104,tripaathee saahab ke shabdon se veena ka saahas phir badh gaya tha
sample-chap25-102.wav,254060,ghar pahunch kar inhonne dekha ki pannaalaal va nirmala aae hue the
sample-chap25-103.wav,284048,veena apanee maan ko dekhakar usase lipat gaee aur barabas usakee aankhen bahane lagee
sample-chap25-104.wav,171152,unake aane ka prayojan amit ko apanee maan se gyaat hua
sample-chap25-105.wav,172916,ve veena ko apane saath le jaane ke lie aae the
sample-chap25-106.wav,98828,krashna ka man bhee khinn tha
sample-chap25-107.wav,213488,pita shreeraam apanee aadat ke anusaar chup the
sample-chap25-108.wav,238184,amit ne hee baat chalaee abhee kuchh din ruk jaen bhaabhee to behatar hoga
sample-chap25-109.wav,127052,shaayad naukaree kee kuchh baat ban jae
sample-chap25-110.wav,211724,beta koee sada ke lie to nahee le ja rahe use ham
sample-chap25-111.wav,359900,maan nirmala ne kaha thode badalaav se isaka man bhee theek ho jaega aur thoda hamen bhee achchha lagega
sample-chap25-112.wav,162332,ghar mein har samay isee mein dhyaan laga rahata hai
sample-chap25-113.wav,306980,tab krashna ne kaha hamaara bhee ab kaun hai veena to meree apanee betee hai
sample-chap25-114.wav,247004,dev nahee raha ab isee ko dekhakar yahee lagata hai hamaara doosara dev yahee hai
sample-chap25-115.wav,502784,aapakee hee betee hai bahan jee main aapase nivedan karata hoon ki aap bhee chalie kuchh din hamaare paas rah aaie
sample-chap25-116.wav,90008,aapako bhee achchha lagega
sample-chap25-117.wav,109412,yah pannaalaal ne kaha tha krashna se
sample-chap25-118.wav,437516,tab pita shreeraam ne apanee chuppee todee veena ka man hai to le jaie beshak usakee khushee mein hee hamaaree khushee hai
sample-chap25-119.wav,291104,veena ko deharaadoon jaane kee sochakar hee achchha lag raha tha
sample-chap25-120.wav,141164,ekaek use laga ki kaheen kuchh khaaleepan hai yahaan
sample-chap25-121.wav,151748,yahaan se door hatakar achchha lagega use
sample-chap25-122.wav,236420,aise mein naukaree milane se behatar use lag raha tha kuchh aaraam
sample-chap25-123.wav,425168,naukaree paane kee laalasa jo dopahar tak thee usake man mein usase upar uth aaee maan ke paas baithakar aaraam karane kee chaah
sample-chap25-124.wav,372248,aise mein amit kuchh kahata to shaayad veena ko nirmala va pannaalaal ko anyatha lag sakata tha
sample-chap25-125.wav,119996,usane chup rahana hee behatar samajha
sample-chap25-126.wav,315800,agale din subahasavere vah un sabako bas par bitha kar laut aaya
sample-chap25-127.wav,264644,chaahakar bhee amit maan nirmala se priya kee koee baat nahin kar paaya
sample-chap25-128.wav,294632,chaahakar bhee veena bhaabhee ke haath priya ko koee patr na bhej saka
sample-chap25-129.wav,217016,use uchit nahee lag raha tha aise mein priya kee koee baat bhee karana
sample-chap25-130.wav,582164,haan veena ne bas par chadhatechadhate usase poochh liya tha kuchh kahana hai priya ko ekaek kuchh sujhaee nahee diya use bas yahee bol saka meree hailo kahana
sample-chap25-131.wav,165860,amit kee dinacharya bilkul badal gaee thee
sample-chap25-132.wav,661544,ekaek use laga vah kaam hote hue bhee bilkul khaalee ho gaya hain kahaan subah se shaam tak apane kaam ke baad use sirph ek hee chinta satae rahatee thee dev kee veena kee
sample-chap25-133.wav,725048,aur dev ke baad do maheene sirph veena kee aur ab kuchh nahee subah uthata naashta karata apane kaam par chala jaata aur koshish rahatee usakee jyaada se jyaada der tak bana rahe
sample-chap25-134.wav,190556,ghar lautakar use kuchh karana achchha nahee lagata tha
sample-chap25-135.wav,264644,der raat ghar lautata nahaakar khaana khaata aur so jaata
sample-chap25-136.wav,225836,sotesote need khulatee to priya ko yaad karane lagata
sample-chap25-137.wav,312272,kabhee raat ek baje kabhee do baje to kabhee teen baje uthakar use patr likhata
sample-chap25-138.wav,538064,veena ko gae pandrah din ho gae the aur is beech priya ke kaee patr aae usane bhee use lagabhag roj ek patr likha
sample-chap25-139.wav,209960,bhaabhee ke lie usake paas vahee shabd the
sample-chap25-140.wav,112940,bhaabhee ke bina ghar soona hai
sample-chap25-141.wav,90008,khaaleekhaalee lagata hai
sample-chap25-142.wav,176444,kab ghar mein khaana banata hai kab khatm ho jaata hai
sample-chap25-143.wav,132344,soonepan ke atirikt kuchh nahee
sample-chap25-144.wav,294632,aur priya bhee yahee kuchh likha karatee deedee ab bahut badal gaee hai
sample-chap25-145.wav,148220,chup rahane ke siva kuchh nahee karatee
sample-chap25-146.wav,158804,ek minat bhee akela chhodo to rone lagatee hai
sample-chap25-147.wav,165860,dev kee yaad usaka peechha nahee chhodatee
sample-chap25-148.wav,128816,ham bhee use akela nahee chhodate
sample-chap25-149.wav,342260,aise mein amit deedee ko dillee bhejana uchit hai kya aur aise mein amit kuchh nahee likh paata
sample-chap25-150.wav,172916,prophesar tripaathee bhee aae the is beech
sample-chap25-151.wav,418112,unheen se maaloom pada kee prinsipal ne mainejing kametee se veena ke lie aaphis kee naukaree ke lie peshakash kee thee
sample-chap25-152.wav,187028,veena kee anupasthiti mein kuchh nahin ho sakata tha
sample-chap25-153.wav,164096,tab amit ne deharaadoon jaane ka nirnay kar liya
sample-chap25-154.wav,529244,maanbaapoo jee ko is vishay mein usane sankshep mein soochit kar diya aur agale hee din subah chaar baje kaar uthaakar deharaadoon ke lie ravaana ho gaya
sample-chap25-155.wav,404000,maan ne use keval itana hee kaha ek din se jyaada tum na rukana aur veena ko saath hee lekar aana
sample-chap25-156.wav,261116,aur amit apanee dhun mein kaar chalata hua chaar ghante mein hee deharaadoon pahunch gaya
sample-chap25-157.wav,232892,na kaar raaste mein rokee usane aur na hee speed kam huee
sample-chap25-158.wav,215252,subahasavere sadak par yaataayaat shoony ke baraabar tha
sample-chap25-159.wav,335204,amit ko aaya dekhakar sabhee ne usaka bahut garmajoshee se svaagat kiya
sample-chap25-160.wav,118232,priya use ekatak dekhatee hee rah gaee
sample-chap25-161.wav,204668,amit ne dekha khushee se usake gaal laal ho gae the
sample-chap25-162.wav,172916,shabd na juta paee kuchh ekaek use saamane dekhakar
sample-chap25-163.wav,225836,bas khusheekhushee bhaagakar usake lie chaay bana laee
sample-chap25-164.wav,165860,amit ka aana veena bhaabhee ko bhee achchha laga
sample-chap25-165.wav,345788,chaay peetepeete amit ne veena se kaha prinsipal ne aapake lie klerikal post ke lie hee manjooree dee hai
sample-chap25-166.wav,114704,aur vah mujhe nahin karanee
sample-chap25-167.wav,137636,veena ne do tuk utar diya
sample-chap25-168.wav,162332,aisa to mainne bhee kaha hai prophesar tripaathee ko
sample-chap25-169.wav,261116,lekin unakee raay hai ki aapake protest kie bina kuchh nahin ho sakata
sample-chap25-170.wav,321092,dekho amit jahaan tak sirph naukaree kee baat hai uchit hai unakee yah aaphar
sample-chap25-171.wav,465740,lekin jis kaalej mein dev prophesar tha vahaan usakee patnee ko ve log klark bana kar rakh chhoden yah dev ke naam ka apamaan hoga
sample-chap25-172.wav,151748,haan mujhase kahate ek saal mehanat karo
sample-chap25-173.wav,165860,bhaabhee abhee baat samaapt kahaan huee hai
sample-chap25-174.wav,61784,abhee to samay hai
sample-chap25-175.wav,118232,ham sab baaten unhen kah sakate hai
sample-chap25-176.wav,488672,tab veena kuchh sochatee rahee phir bolee dekho amit sach kahoon to yahaan aakar mujhe laga ki mujhamen himmat nahee abhee kuchh karane kee
sample-chap25-177.wav,178208,main abhee svayan ko bahut halka mahasoos kar rahee hoon
sample-chap25-178.wav,426932,dev ke bina to kuchh achchha nahee lagata na yahaan na dillee mein dillee mein dev nahee ab dillee jaane ka man bhee nahee
sample-chap25-179.wav,254060,veena chaahakar bhee apane aansuon ka pravaah na rok paee
sample-chap25-180.wav,247004,dillee se naata tod logee bhaabhee itanee jaldee maanbaaboo jee bhee to hain
sample-chap25-181.wav,97064,amit ka svar bharra aaya tha
sample-chap25-182.wav,259352,sab hai amit lekin sabake beech main akelee pad gaee hoon
sample-chap25-183.wav,171152,veena ke aansoo bahane lage main yahaan bhee akelee hoon
sample-chap25-184.wav,315800,sabake lie ek hee baat hai ki veena ka ab kya hoga shaadee se pahale aisa nahee tha
sample-chap25-185.wav,82952,yah veena ka ghar tha
sample-chap25-186.wav,127052,ab to main yahaan bhee paraee hoon
sample-chap25-187.wav,149984,aur veena rone lagee phootaphootakar
sample-chap25-188.wav,259352,are veena betee aisa kyon kah rahee hai too too hamase bhee man hee man ruthee hai
sample-chap25-189.wav,60020,sabase ruthee hai
sample-chap25-190.wav,361664,kyon aisee dasha bana rakhee hai toone tab maan nirmala ne usake sir ko apanee baahon mein lekar sahalaate hue kaha
sample-chap25-191.wav,229364,main kisee se nahin ruthee maan mera bhaagy mujhase rutha hai
sample-chap25-192.wav,259352,dekho na bhaagy rutha hai tabhee to sabhee mere bhaagy ka rona rote hai
sample-chap25-193.wav,264644,aise mein main kaise hansoo veena ke aansoo rukane ka naam nahee le rahe the
sample-chap25-194.wav,425168,tab amit ne bharrae shabdo mein kaha bhaabhee mujhase koee bhool ho gaee ho ya kuchh galat kaha ho to maaph kar do
sample-chap25-195.wav,68840,lekin roo nahin
sample-chap25-196.wav,146456,nahee amit tum galat na samajho mujhe
sample-chap25-197.wav,135872,meree jagah khade hokar socho
sample-chap25-198.wav,523952,yadi mujhe shaantasukhee dekhana chaahate ho to bolo kya uchit hai mere lie main kuchh karana chaahatee hoon lekin bheekh ke katore mein kuchh lekar nahin
sample-chap25-199.wav,112940,apanee yogyata ke bal par
sample-chap25-200.wav,382832,aur usase upar main kuchh samay akele rahana chaahatee hoon aur iseelie socha hai na dillee rahoon na deharaadoon
sample-chap25-201.wav,238184,masooree ke kisee skool ko jyain kar loon aur vaheen hostal mein rahoon
sample-chap25-202.wav,123524,veena ne ekaek man kee baat kahee
sample-chap25-203.wav,68840,sab saaph ho gaya
sample-chap25-204.wav,183500,amit bhee vahee karana chaahata tha jo veena chaahatee thee
sample-chap25-205.wav,149984,vah veena kee ichchha ko nahee badalana chaahata tha
sample-chap25-206.wav,104120,yah to achchhee baat hain
sample-chap25-207.wav,171152,aapako vahee karana chaahie jo aapako svayan achchha lage
sample-chap25-208.wav,254060,aise mein aap do took shabdon mein kah detee mujhe dillee naukaree nahee karanee
sample-chap25-209.wav,107648,bas tab amit bhee sambhal gaya
sample-chap25-210.wav,294632,main kah sakatee thee lekin chup thee maanbaaboo jee kya sochenge beta chala gaya
sample-chap25-211.wav,104120,ab bahoo bhee nahee aana chaahatee
sample-chap25-212.wav,428696,na jaane kaise main tumhaare parivaar se itana bandh gaee hoon amit ki na tum logon se door jaate banata hai ab na nikat rahate
sample-chap25-213.wav,243476,dev mein jo aakarshan tha usakee dor bahut majaboot hai amit
sample-chap25-214.wav,91772,veena phir rone lagee
sample-chap25-215.wav,352844,aise mein amit ne man kee baat kahee achchha hai bhaabhee man se jo karana chaaho vahee karo
sample-chap25-216.wav,114704,maanbaaboo jee ko main sambhaal loonga
sample-chap25-217.wav,315800,din bhar amit priya ke saath ghoomata raha aur shaam chaar baje dillee ke lie ravaana ho gaya
sample-chap25-218.wav,157040,raat das baje ke kareeb vah dillee lauta
sample-chap25-219.wav,206432,krashna va shreeraam jaise usee kee prateeksha mein baithe the
sample-chap25-220.wav,197612,amit ko akela aae dekhakar unaka man udaas ho gaya
sample-chap25-221.wav,472796,dheeredheere usane saaree baaten unhen samajha deen aur saath hee kaha ab achchha yahee rahega ki ham bhaabhee ko apane man kee karane den
sample-chap25-222.wav,199376,use jo achchha lagata hai vahee hamen achchha lagana chaahie
sample-chap25-223.wav,453392,tab krashna ne kaha lekin main biraadaree ko kya kahoongee sab log to yahee kahenge ki beta gaya to bahoo ko bhee maayake bhej diya
sample-chap25-224.wav,352844,kahane ko bahut kuchh hai logon ke paas lekin jaruree nahin ki bekaar kee baaton ko tool diya jae
sample-chap25-225.wav,245240,koee kuchh bhee kahe lekin hamaaree khushee bhaabhee kee khushee mein hai bas
sample-chap25-226.wav,351080,amit ke shabdon ka arth jaanakar shreeraam ne hee kah diya krashna se amit theek kah raha hai
sample-chap25-227.wav,95300,duniyaan kee hamen koee paravaah nahee
sample-chap25-228.wav,127052,tab krashna kuchh aur na bol paee
sample-chap25-229.wav,248768,use apanee udaasee apana duhkh pahale se adhik badha hua lag raha tha
sample-chap25-230.wav,370484,masooree mein veena ko kaanvet aaph jeejas end meree mein naukaree mil gaee
sample-chap25-231.wav,257588,sistar supreem ne use haan kahane mein jaraasa bhee samay nahin maanga
sample-chap25-232.wav,324620,veena kee aap beetee aur usakee vartamaan dasha hee jaise usake lie sabase badee pahachaan ban gaee thee
sample-chap25-233.wav,303452,veena ka vaheen doosaree adhyaapikaon ke saath rahane ka prabandh bhee ho gaya
sample-chap25-234.wav,476324,kuchh hee dinon mein hostal ke niyamon mein veena bandh kar itanee vyast ho gaee ki agale ek maah mein keval ek din ke lie deharaadoon gaee
sample-chap25-235.wav,174680,vaise bhee avakaash milana kathin tha sabhee ke lie
sample-chap25-236.wav,291104,subah saat baje se lekar shaam aath baje tak koee na koee kaam rahata tha use
sample-chap25-237.wav,287576,subahashaam bachchon ke saath hostal mein aur din mein kakshaon mein vyastata banee rahatee thee
sample-chap25-238.wav,746216,lekin itanee vyastata ke baavajood raat der gae aksar usakee neend khul jaatee aur khidakee ke paas khadee hokar vah baahar door tak phaile andhiyaare mein banateebigadatee syaah parachhaeeyon ko hee der tak ghoora karatee
sample-chap25-239.wav,319328,kabhee sisak padatee to usakee rumamet neera uth kar usako saantvana diya karatee
