filename,wave_size,text
sample-chap14-0.wav,17389,dev ko teen din baad phir dard hua
sample-chap14-1.wav,18434,saaree raat veena usakee maalish karatee rahee
sample-chap14-2.wav,18643,ekek karake dev ne dard kee chaar goliyaan kha leen
sample-chap14-3.wav,11328,tab kaheen vah so paaya
sample-chap14-4.wav,25121,subahasavere veena ne amit se dev kee dasha ke vishay mein baat kee
sample-chap14-5.wav,14672,vah bhee chintit ho utha
sample-chap14-6.wav,14254,dev us samay baatharoom mein tha
sample-chap14-7.wav,46855,veena ke paas samay tha amit se baat karane ka bolee vah  amit us din doktar gupta kee baat sunakar mujhe dar lag gaya
sample-chap14-8.wav,44138,ekaek aisa laga ki jaise vah kahana chaah rahe hon ki aage yadi dard ho to ve doosare kisee aspataal mein jaen
sample-chap14-9.wav,23240,vahaan ke speshalist ko dikhaen aur rediyotharaipee karava len
sample-chap14-10.wav,29510,amit yah sunakar bola  rediyotharaipee aapane us din to mujhe bataaya nahin
sample-chap14-11.wav,21568,use tanik aashchary hua  usakee kya jaroorat hai
sample-chap14-12.wav,18225,vah to bola ki mainne opareshan ke baad hee kaha tha
sample-chap14-13.wav,21777,veena ne sanyat svar mein kaha  ab bhee der nahin huee
sample-chap14-14.wav,17389,dev ko dard baarabaar uth raha hai
sample-chap14-15.wav,27420,aisa kyon kaha usane  apane man ke bhay ko kuchh ujaagar kiya usane
sample-chap14-16.wav,46855,main kya jaanoon bhaabhee usane aisa kyon kaha haan opareshan ke baad usane aisa kuchh nahin kaha tha isaka mujhe poora pata hai
sample-chap14-17.wav,26375,tab vah baat ramesh bhaee ya mohan bhaee se hee karata tha
sample-chap14-18.wav,13836,ve saaree baaten mujhe bata dete the
sample-chap14-19.wav,20106,amit kee baat mein sachchaee thee veena ko laga
sample-chap14-20.wav,15090,veena kee aankhon se aansoo tapak pade
sample-chap14-21.wav,13418,amit bhee bhaavuk ho gaya
sample-chap14-22.wav,14672,bola  bhaabhee duhkhee mat hoeee
sample-chap14-23.wav,17389,main to har kisee se aapakee misaal deta hoon
sample-chap14-24.wav,25539,aapane kitanee himmat kee dev se shaadee kee haan karake
sample-chap14-25.wav,18225,veena ne aansoo ponchhate hue dekha amit kee or
sample-chap14-26.wav,10910,ghar mein sabase chhota
sample-chap14-27.wav,15717,shabdon mein kaheen use chaturaee na dikhee
sample-chap14-28.wav,25957,ekaek kah uthee tum bhee aisa hee samajhate ho ki mujhe pata tha
sample-chap14-29.wav,31390,haan vigyaapan to jo banaaya tha vah dev ne hee likh kar diya tha
sample-chap14-30.wav,45601,shesh main itanee baat jaanata hoon ki dev ne aapase jaroor baat kee hogee ya phir ramesh bhaee ne aapake daidee se
sample-chap14-31.wav,14463,amit ko aashchary ho raha tha
sample-chap14-32.wav,10493,veena ke mukh se aisa sunakar
sample-chap14-33.wav,23031,veena tab bolee  tumhen premasa darja diya hai
sample-chap14-34.wav,15090,apana chhota bhaee maanane lagee hoon
sample-chap14-35.wav,32644,tumase hee kahakar man halka kar rahee hoon ki mujhe is baat ka kuchh pata nahin chala
sample-chap14-36.wav,39959,vigyaapan mein jo likha tha vah to medikal tarm mere kya kisee bhee padhelikhe ko samajh nahin aa sakatee
sample-chap14-37.wav,25121,lekin usake baad kisee ne bhee is baat ka jikr nahin kiya
sample-chap14-38.wav,25957,mere ghar vaale to abhee bhee nahin jaanate ki dev mein koee kamee hai bhee
sample-chap14-39.wav,33689,sab meree aur dev kee jodee ko dekhadekh kar hee khushee se bhare hain
sample-chap14-40.wav,16762,veena kee baat sunakar sann rah gaya amit
sample-chap14-41.wav,41004,bola  ye kaise ho sakata hai bhaabhee main jo ghar bhar kee jimmevaaree nibhaata hoon main bhee is dhokhe mein raha
sample-chap14-42.wav,29092,thoda aavesh mein aa gaya vah  main aaj hee ramesh bhaee ko patr likhakar poochhoonga
sample-chap14-43.wav,13418,unhonne yah baat kyon nahin kholee
sample-chap14-44.wav,17180,nahin tum aisa kuchh nahin karoge
sample-chap14-45.wav,9657,kisee se bhee nahin bologe
sample-chap14-46.wav,13627,aur na hee dev se bhee kuchh poochhoge
sample-chap14-47.wav,21986,tumhen meree kasam is baat ko tumase kah diya yahee kaaphee hai
sample-chap14-48.wav,14463,na jaane kaise main himmat kar baithee
sample-chap14-49.wav,18016,aaj mere dil ka bojh halka ho gaya hai
sample-chap14-50.wav,14672,lekin jo kuchh kaha hai bhaee maanakar
sample-chap14-51.wav,14045,isase aage tum chup rahoge
sample-chap14-52.wav,13627,vah bolatee ja rahee thee
sample-chap14-53.wav,11955,mammeedaidee aa rahe hain
sample-chap14-54.wav,15508,dhyaan rahe unhen kuchh na pata lage
sample-chap14-55.wav,17389,mere daidee vaise to bahut shaant prakrti ke hain
sample-chap14-56.wav,19479,par jab unhen gussa aa jae to kuchh ka kuchh kar dete hain
sample-chap14-57.wav,14672,na jaane kya nirnay le baithen
sample-chap14-58.wav,18225,mainne sab apane bhaagy par chhod diya hai
sample-chap14-59.wav,22613,dev ka mere jeevan mein aana likha tha vah ho gaya
sample-chap14-60.wav,11955,ab jo hoga achchha hee hoga
sample-chap14-61.wav,19897,mujhe to lagata bhee nahin ki main kabhee dev ko nahin jaanatee thee
sample-chap14-62.wav,14881,main man se dev ko chaahane lagee hoon
sample-chap14-63.wav,43511,aise mein tum meree itanee hee madad kar do ki mere maataapita jaise hansate hue khushee se aaen vaise hee vah lauten
sample-chap14-64.wav,27002,shesh jo hoga jaisa hoga achchha hee hoga aisa mera vishvaas hai
sample-chap14-65.wav,44556,amit ko lagee veena deveeroop ek shakti is tej raphtaar se chalatee jindagee mein anoothee aurat
sample-chap14-66.wav,30555,jise shaadee ke baad pata laga ki usake saath dhokha hua hai lekin khush hai
sample-chap14-67.wav,19270,apanee khaatir hee nahin apane parivaar kee bhee khaatir
sample-chap14-68.wav,17598,jisane kitanee khushee se sab apana liya hai
sample-chap14-69.wav,26793,abhee das minat pahale tak use jo lag raha tha vah to bilkul asaty tha
sample-chap14-70.wav,29301,usake man mein jo bhaav the vah aur oopar utha gae veena ke svaroop ko
sample-chap14-71.wav,16553,barabas usakee aankhon se aansoo bah nikale
sample-chap14-72.wav,16971,bola vah  main bhee aapaka gunaahagaar hoon
sample-chap14-73.wav,13418,mujhe jo chaahe saja de do
sample-chap14-74.wav,26375,kaisee baat karate ho amit bhaee samajha tabhee man kee baat kah rahee hoon
sample-chap14-75.wav,9657,aisa kuchh bhee mat socho
sample-chap14-76.wav,15090,mujhe tumase kya kisee se gila nahin hai
sample-chap14-77.wav,22195,veena kee baat sunakar amit natamastak ho gaya
sample-chap14-78.wav,18852,baatharoom se paanee chalane kee aavaaz band ho gaee thee
sample-chap14-79.wav,42884,dev ke nikal aane mein chand hee minat the tab veena ne baat samaapt karate hue kaha  dhyaan rakhana jo tumhen kaha hai
sample-chap14-80.wav,18225,aur yah kahakar vah rasoeeghar kee or badh gaee
sample-chap14-81.wav,14045,aur amit apane kamare mein chala gaya
sample-chap14-82.wav,34107,dev ko devarabhaabhee ke beech hue vaartaalaap ka kuchh pata na chala
sample-chap14-83.wav,26166,apane maataapita se milakar veena ka man prasann ho utha
sample-chap14-84.wav,38287,pyaar se maan kee godee mein sir rakh kar aankhen band kar leen usane
sample-chap14-85.wav,9030,maan ka sahaara
sample-chap14-86.wav,18225,maan jise vah apane dil ka sab haal bata sakatee thee
sample-chap14-87.wav,25330,maan jo usake man kee bhaasha ko badee saralata se padh sakatee thee
sample-chap14-88.wav,34107,maan nirmala ko lag raha tha jaise veena bahut dinon baad shaanti pa rahee hai usase milane ke baad
sample-chap14-89.wav,26375,jaise man mein usake dherasee baaten hain jo vah usase kahana chaahatee hai
sample-chap14-90.wav,39541,aise mein hee jab ve donon kamare mein akele rah gae tab poochha nirmala ne  veena too khush hai na
sample-chap14-91.wav,13627,haan maan bahut khush hoon
sample-chap14-92.wav,14672,veena ne aankhen band kie hue kaha
sample-chap14-93.wav,6104,bahut khush hoon
sample-chap14-94.wav,24494,aur usake shaant chehare par band aankhon se aansoo bahane lage
sample-chap14-95.wav,53333,yah aansoo khushee ke the ya ki kisee gam kee pahachaan karava rahe the ekaek nirmala na samajh paee bolee  are aansoo kyon bahaatee ho
sample-chap14-96.wav,33480,mujhase milane kee itanee chaah thee to chalee aatee deharaadoon main door to nahin itanee
sample-chap14-97.wav,50408,usakee aankhen ponchhate hue bolee  shaadee ke baad rahee bhee kitana hai too mere paas do hee din ab naagapur se aaoongee to saath chalana mere
sample-chap14-98.wav,14463,dasapandrah din mere paas rahana
sample-chap14-99.wav,12373,dev aakar tujhe le jaenge
sample-chap14-100.wav,26584,aankhen band kie veena ne tab kaha  tum laut aao maan naagapur se
sample-chap14-101.wav,11955,mere paas rahana kuchh din
sample-chap14-102.wav,16344,mere lie to dev ko chhodakar jaana mushkil hai
sample-chap14-103.wav,30346,are kyon mushkil hai  maan ko veena ka yoon kahana achchha bhee laga
sample-chap14-104.wav,13000,man mein socha kitanee achchhee baat hai
sample-chap14-105.wav,34316,patipatnee mein itana pyaar ho gaya hai ki ab ekadoosare ke bina kaheen rahana nahin chaahate
sample-chap14-106.wav,19897,vaise hee bhaav lie bolee  achchha laga sunakar
sample-chap14-107.wav,13836,par betee maan ko bhee to teree yaad aatee hai
sample-chap14-108.wav,10910,dev jee se main kahoongee
sample-chap14-109.wav,16135,kuchh din jaroor rahane ko chalana mere saath
sample-chap14-110.wav,18225,veena ko laga vah bhaavuk ho uthegee
sample-chap14-111.wav,22195,man kee baat kaheen shabd banakar mukh se nikal na jaen
sample-chap14-112.wav,9030,ekaek uthakar baith gaee
sample-chap14-113.wav,34943,aankhen saaph karate hue bolee  chalo na maan aap naagapur se pahale achchhee khabar le aao
sample-chap14-114.wav,16971,mera kya hai jab man aaega main aa jaoongee
sample-chap14-115.wav,17389,aur rajanee kee shaadee kee taareekh pakkee ho jaegee
sample-chap14-116.wav,20733,tab to main shaadee se pahale aakar saath hee to rahoongee aapake
sample-chap14-117.wav,11746,baat vaheen ruk gaee
sample-chap14-118.wav,13418,dev kolej se laut aaya tha
sample-chap14-119.wav,30764,maan nirmala va pita pannaalaal ko usane charan sparsh kiya aur unaka haalachaal poochhane laga
sample-chap14-120.wav,23031,baaton hee baaton mein nirmala ko laga ki dev jaise bechain hai
sample-chap14-121.wav,26375,poochh uthee vah  tabiyat theek hai na dev jee kuchh bechain lag rahe hain
sample-chap14-122.wav,39750,dev tab halkaasa dard mahasoos kar raha tha use dabaate hue bola  nahin bas thak gaya hoon
sample-chap14-123.wav,18016,iseelie thoda sir mein dard mahasoos ho raha hai
sample-chap14-124.wav,14463,maan ko sach lagee usakee baat
sample-chap14-125.wav,15717,bolee  chalo beta aap aaraam kar lo
sample-chap14-126.wav,16553,main thodee der bahanajee ke paas baithatee hoon
sample-chap14-127.wav,16553,vaise bhee shaam kee to hamaaree gaadee hai
sample-chap14-128.wav,15717,maan ne patipatnee ko akela chhod diya
sample-chap14-129.wav,20524,veena tab bolee  dard ho raha hai kya
sample-chap14-130.wav,20524,haan halkaasa kolej mein hee golee kha lee thee
sample-chap14-131.wav,11328,dev ne tab kaha
sample-chap14-132.wav,11746,aankhen bojhil ho rahee theen usakee
sample-chap14-133.wav,10910,aap aaraam kar leejie
sample-chap14-134.wav,11746,main khaana taiyaar karatee hoon
sample-chap14-135.wav,13836,shaam tak aaraam aa jaega
sample-chap14-136.wav,18434,theek rahenge to mammeedaidee ko steshan chhodane chalenge
sample-chap14-137.wav,15926,veena tab kamare se baahar jaane ko huee
sample-chap14-138.wav,35988,dev ne tab poochha  kuchh baat to nahin huee mammeedaidee se   man ka chor ujaagar kiya usane
sample-chap14-139.wav,11119,jaise isee baat kee pareshaanee thee
sample-chap14-140.wav,14672,iseelie hee bechain tha vah
sample-chap14-141.wav,28674,kaisee baat karate hain aap chalie aaraam keejie   aur veena baahar nikal gaee
sample-chap14-142.wav,27420,dev ka aadha dard to use theek hota mahasoos hua
sample-chap14-143.wav,18434,naagapur se laut kar maan nirmala ne achchhee khabar dee
sample-chap14-144.wav,13000,rajanee kee shaadee vah pakkee kar aae the
sample-chap14-145.wav,15926,do maheene baad ka mahoort nikala tha
sample-chap14-146.wav,16762,ladake vaale deharaadoon aane ko maan gae the
sample-chap14-147.wav,29510,ladake vaalon mein hai hee kaun ladaka hee apane ghar ka kartaadharta hai
sample-chap14-148.wav,17598,bade bhaiya to usake relave mein cheephinjeeniyar hain
sample-chap14-149.wav,12791,apanee naukaree mein mast rahate hain
sample-chap14-150.wav,24703,chhote do bhaee aur hain ve bhee apaneapane kaam mein lage rahate hain
sample-chap14-151.wav,6313,maan vidhava hai
sample-chap14-152.wav,44556,vah bechaaree to yahee kahatee rahee ki patron ka javaab dene ke lie vah apane bade bete ko likhatee thee lekin use unakee chinta nahin
sample-chap14-153.wav,13418,tab himmat karake ladake ne svayan likha
sample-chap14-154.wav,9657,baat kuchh bhee nahin thee
sample-chap14-155.wav,8821,ve yoon hee chup baithe the
sample-chap14-156.wav,22404,maan ne veena ko vistaar se sab baat bataate hue kaha
sample-chap14-157.wav,25957,ladake ke baare mein sab dekh liya na maan  veena ne tab poochha
sample-chap14-158.wav,5686,bhale log hain
sample-chap14-159.wav,17807,isase adhik aur kya dekhasamajh sakate hain ham
sample-chap14-160.wav,10910,vishvaas to karana hee padata hai
sample-chap14-161.wav,63364,ladakee kee shaadee to jua hai betee grhasthee theek chalatee rahe yahee kaamana kar sakate hain ladakee vaale aur jo shaadee ke baad hota hai vah sab ladakee ka apana bhaagy hee hota hai
sample-chap14-162.wav,19688,maan nirmala ne sahaj bhaav se kaha veena se
sample-chap14-163.wav,21986,ve kya jaane veena kee baat mein chhipe marm ko
sample-chap14-164.wav,10701,haan maan tum theek kahatee ho
sample-chap14-165.wav,25330,shaadee ke baad jo kuchh bhee hota hai vah ladakee ke bhaagy mein likha hota hai
sample-chap14-166.wav,45601,shaadee ek aisa bandhan hai hamaare samaaj ka jise jitana nibhaana chaaho jaise nibhaana chaaho vaise hee nibh jaata hai
sample-chap14-167.wav,16135,kuchh baaten to jaanakar bhee nahin dekh paate ham
sample-chap14-168.wav,17180,kuchh baaten samajhakar bhee samajh nahin paate ham
sample-chap14-169.wav,16344,baatabaat par shak to nahin kiya ja sakata
sample-chap14-170.wav,24076,phir bhee rajanee ka bhaagy balavaan hoga yahee kaamana hai meree
sample-chap14-171.wav,23658,haan betee rajanee ka bhaagy apanee donon badee bahanon jaisa hee hoga
sample-chap14-172.wav,13000,suneeta khush hai apane pati ke saath
sample-chap14-173.wav,12373,tum khush ho apane pati ke saath
sample-chap14-174.wav,11328,hamaara jeevan to saphal ho gaya
sample-chap14-175.wav,39332,rajanee ke baad bas priya aur geeta ke haath peele ho jaen jaldee se to mera jeevan bhee saphal ho jaega
sample-chap14-176.wav,16971,maan kee aankhon mein chhipee khushee ko veena ne sahaara diya
sample-chap14-177.wav,26793,vah usakee aankhon kee chamak ko kam nahin aur adhik badhate hue dekhana chaah rahee thee
sample-chap14-178.wav,25539,bolee  priya ke lie maan mujhe amit bahut achchha lagata hai
sample-chap14-179.wav,8821,bahut achchha ladaka hai
sample-chap14-180.wav,11119,apane parivaar mein sabase alag
sample-chap14-181.wav,11746,sab kee bhaavanaon kee chaah rahatee hai use
sample-chap14-182.wav,15508,mera to bahut dhyaan rakhata hai
sample-chap14-183.wav,37660,amit ke prati apanee bhaavanaon ko vah maan ke sammukh vyakt kar rahee thee aur kah baithee  main bhee yahaan khush hoon
sample-chap14-184.wav,18016,aur amit to apanee patnee ko palakon par bitha kar rakhega
sample-chap14-185.wav,19688,maan ko jaise veena kee baat bahut achchhee lagee
sample-chap14-186.wav,12164,bolee  main priya se poochhoongee
sample-chap14-187.wav,14881,daidee se bhee baat karoongee tumhaare
sample-chap14-188.wav,30555,jaise kuchh yaad aaya unhen bolee  priya ke janmadin par amit ka kaard bhee aaya tha
sample-chap14-189.wav,13418,vah bhee use paakar khush huee thee
sample-chap14-190.wav,21986,veena ko yah khabar sunakar aashchary hua
sample-chap14-191.wav,17180,amit ne apane man kee baat usase chhipa kar rakhee thee
sample-chap14-192.wav,17598,use amit par aur adhik sneh umad aaya
sample-chap14-193.wav,24912,priya ke lie use amit mein koee kamee jo nahin lag rahee thee
sample-chap14-194.wav,9866,unakee baat vaheen ruk gaee
sample-chap14-195.wav,41004,shaam amit apane kaam se laut kar jab aaya to veena ne use chheda  amit priya ne tumhaaree shikaayat kee hai
sample-chap14-196.wav,42466,ekaek priya ka naam sunakar vah hadabada gaya bola  meree shikaayat mainne kya kiya hai   yah to tum hee jaano
sample-chap14-197.wav,39750,mujhase to baaton hee baaton mein poochha tha usaka janmadin aur phir tumane kya kiya main kya jaanoon  muskura rahee thee veena
sample-chap14-198.wav,43511,mainne kya kiya  sochane ka naatak kiya amit ne  mainne kuchh nahin kiya bas aapake greeting kaard ke saath apana bhee ek kaard bhej diya
sample-chap14-199.wav,15090,muskuraane laga vah yah kahakar
sample-chap14-200.wav,38705,bas yahee shikaayat ki usake baad amit ne usakee koee khabar nahin lee  veena kee baat sunakar amit khush ho gaya
sample-chap14-201.wav,29092,aisee baat hai bhaabhee jaanatee ho main usake naam roz kuchh na kuchh likhata hoon apanee daayaree mein
sample-chap14-202.wav,53960,amit jo kitane dinon se himmat kar raha tha apane man kee baat kahane kee vah itanee saralata se bata paayega veena ko isaka to use andesha bhee na tha
sample-chap14-203.wav,25748,vah kah raha tha  ab mujhe lagata hai use patr likhana chaahie
sample-chap14-204.wav,16135,aisa mujhase kyon poochh rahe ho khud se nirnay lo
sample-chap14-205.wav,14881,veena ke chehare par sneh bhare bhaav the
sample-chap14-206.wav,40377,amit ko apanee munh maangee muraad pooree hotee dikh rahee thee
